{
    "$schema": "http://json-schema.org/schema#",
    "type": "object",
    "properties": {
        "status": {
            "type": "string"
        },
        "policy": {
            "type": "object",
            "properties": {
                "name": {
                    "type": "string"
                },
                "description": {
                    "type": "string"
                }
            },
            "required": [
                "description",
                "name"
            ]
        },
        "findingKey": {
            "type": "string"
        },
        "findingId": {
            "type": "string"
        },
        "cloudGuardAccountId": {
            "type": "string"
        },
        "origin": {
            "type": "string"
        },
        "bundle": {
            "type": "object",
            "properties": {
                "name": {
                    "type": "string"
                },
                "description": {
                    "type": "string"
                },
                "id": {
                    "type": "integer"
                }
            },
            "required": [
                "description",
                "id",
                "name"
            ]
        },
        "reportTime": {
            "type": "string"
        },
        "rule": {
            "type": "object",
            "properties": {
                "name": {
                    "type": "string"
                },
                "ruleId": {
                    "type": "string"
                },
                "description": {
                    "type": "string"
                },
                "remediation": {
                    "type": "string"
                },
                "complianceTags": {
                    "type": "string"
                },
                "logicHash": {
                    "type": "string"
                },
                "severity": {
                    "type": "string"
                }
            },
            "required": [
                "complianceTags",
                "description",
                "logicHash",
                "name",
                "remediation",
                "ruleId",
                "severity"
            ]
        },
        "account": {
            "type": "object",
            "properties": {
                "id": {
                    "type": "string"
                },
                "name": {
                    "type": "string"
                },
                "vendor": {
                    "type": "string"
                },
                "dome9CloudAccountId": {
                    "type": "string"
                },
                "organizationalUnitId": {
                    "type": "string"
                },
                "organizationalUnitPath": {
                    "type": "string"
                }
            },
            "required": [
                "dome9CloudAccountId",
                "id",
                "name",
                "organizationalUnitId",
                "organizationalUnitPath",
                "vendor"
            ]
        },
        "region": {
            "type": "string"
        },
        "entity": {
            "type": "object",
            "properties": {
                "subjects": {
                    "type": "array",
                    "items": {
                        "type": "object",
                        "properties": {
                            "apiGroup": {
                                "type": "null"
                            },
                            "kind": {
                                "type": "string"
                            },
                            "name": {
                                "type": "string"
                            },
                            "namespace": {
                                "type": "string"
                            }
                        },
                        "required": [
                            "apiGroup",
                            "kind",
                            "name",
                            "namespace"
                        ]
                    }
                },
                "role": {
                    "type": "object",
                    "properties": {
                        "name": {
                            "type": "string"
                        },
                        "rules": {
                            "type": "array",
                            "items": {
                                "type": "object",
                                "properties": {
                                    "apiGroups": {
                                        "anyOf": [
                                            {
                                                "type": "null"
                                            },
                                            {
                                                "type": "array",
                                                "items": {
                                                    "type": "string"
                                                }
                                            }
                                        ]
                                    },
                                    "nonResourceURLs": {
                                        "anyOf": [
                                            {
                                                "type": "null"
                                            },
                                            {
                                                "type": "array",
                                                "items": {
                                                    "type": "string"
                                                }
                                            }
                                        ]
                                    },
                                    "resourceNames": {
                                        "type": "null"
                                    },
                                    "resources": {
                                        "anyOf": [
                                            {
                                                "type": "null"
                                            },
                                            {
                                                "type": "array",
                                                "items": {
                                                    "type": "string"
                                                }
                                            }
                                        ]
                                    },
                                    "verbs": {
                                        "type": "array",
                                        "items": {
                                            "type": "string"
                                        }
                                    }
                                },
                                "required": [
                                    "apiGroups",
                                    "nonResourceURLs",
                                    "resourceNames",
                                    "resources",
                                    "verbs"
                                ]
                            }
                        },
                        "aggregationRule": {
                            "type": "null"
                        },
                        "kind": {
                            "type": "string"
                        }
                    },
                    "required": [
                        "aggregationRule",
                        "kind",
                        "name",
                        "rules"
                    ]
                },
                "kind": {
                    "type": "string"
                },
                "tags": {
                    "type": "array"
                },
                "namespace": {
                    "type": "string"
                },
                "annotations": {
                    "type": "array"
                },
                "labels": {
                    "type": "array"
                },
                "creationTime": {
                    "type": "integer"
                },
                "id": {
                    "type": "string"
                },
                "type": {
                    "type": "string"
                },
                "name": {
                    "type": "string"
                },
                "dome9Id": {
                    "type": "string"
                },
                "accountNumber": {
                    "type": "string"
                },
                "assetLabels": {
                    "type": "null"
                },
                "region": {
                    "type": "string"
                },
                "externalFindings": {
                    "type": "null"
                }
            },
            "required": [
                "accountNumber",
                "annotations",
                "assetLabels",
                "creationTime",
                "dome9Id",
                "externalFindings",
                "id",
                "kind",
                "labels",
                "name",
                "namespace",
                "region",
                "role",
                "subjects",
                "tags",
                "type"
            ]
        },
        "remediationActions": {
            "type": "array"
        },
        "action": {
            "type": "string"
        },
        "additionalFields": {
            "type": "array"
        }
    },
    "required": [
        "account",
        "action",
        "additionalFields",
        "bundle",
        "cloudGuardAccountId",
        "entity",
        "findingId",
        "findingKey",
        "origin",
        "policy",
        "region",
        "remediationActions",
        "reportTime",
        "rule",
        "status"
    ]
}