{"status":"Failed","policy":{"name":"Webhooks","description":""},"findingKey":"T3SuYYlUQge7Rl1e1n87TA","findingId":"T3SuYYlUQge7Rl1e1n87TA","cloudGuardAccountId":"51722","origin":"Compliance Engine","bundle":{"name":"CIS Kubernetes Benchmark v1.6.1","description":"Automated Validation of Kubernetes CIS Benchmark v1.6.1 Prescriptive guidance for establishing a secure configuration posture for Kubernetes 1.6.1\nFor additional reference: https://www.cisecurity.org/benchmark/kubernetes/","id":-70},"reportTime":"2023-06-09T11:00:31.243Z","rule":{"name":"Ensure that default service accounts are not actively used. (RBAC)","ruleId":"D9.K8S.IAM.36","description":"The default service account should not be used to ensure that rights granted to applications can be more easily audited and reviewed. Kubernetes provides a default service account which is used by cluster workloads where no specific service account is assigned to the pod. Where access to the Kubernetes API from a pod is required, a specific service account should be created for that pod, and rights granted to that service account. The default service account should be configured such that it does not provide a service account token and does not have any explicit rights assignments.","remediation":"Create explicit service accounts wherever a Kubernetes workload requires specific access to the Kubernetes API server. Modify the configuration of each default service account to include this value:\nautomountServiceAccountToken: false\n\n**References**\n1. https://kubernetes.io/docs/tasks/configure-pod-container/configure-service-account/\n2. https://aws.github.io/aws-eks-best-practices/iam/#disable-auto-mounting-ofservice-account-tokens (EKS) ","complianceTags":"5.1.5","logicHash":"iyh0kLFb/m3DBPWpu8MYrg","severity":"Low"},"account":{"id":"5af13ab5-72ed-43b6-9544-33c9236d62f0","name":"nu-openshift-cluster","vendor":"Kubernetes","dome9CloudAccountId":"5af13ab5-72ed-43b6-9544-33c9236d62f0","organizationalUnitId":"00000000-0000-0000-0000-000000000000","organizationalUnitPath":""},"region":"Global","entity":{"subjects":[{"apiGroup":null,"kind":"ServiceAccount","name":"default","namespace":"openshift-marketplace"}],"role":{"name":"f066e085c03d92960c884f303e4204521793bc2bb167356ab83ab31fe3b713a","rules":[{"apiGroups":[""],"nonResourceURLs":null,"resourceNames":["f066e085c03d92960c884f303e4204521793bc2bb167356ab83ab31fe3b713a"],"resources":["configmaps"],"verbs":["create","get","update"]}],"aggregationRule":null,"kind":"Role"},"kind":"RoleBinding","tags":[],"namespace":"openshift-marketplace","annotations":[],"labels":[],"creationTime":1676406795,"id":"d2b76a2f-0f52-4abc-a8de-da09c4a83a6b","type":"KubernetesRoleBinding","name":"f066e085c03d92960c884f303e4204521793bc2bb167356ab83ab31fe3b713a","dome9Id":"11|5af13ab5-72ed-43b6-9544-33c9236d62f0|RoleBinding|d2b76a2f-0f52-4abc-a8de-da09c4a83a6b","accountNumber":"5af13ab5-72ed-43b6-9544-33c9236d62f0","assetLabels":null,"region":"Global","externalFindings":null},"remediationActions":[],"action":"Detect","additionalFields":[]}