{"status":"Failed","policy":{"name":"Webhooks","description":""},"findingKey":"qCMOQVnELvLCI/WBHq3ioQ","findingId":"qCMOQVnELvLCI/WBHq3ioQ","cloudGuardAccountId":"51722","origin":"Compliance Engine","bundle":{"name":"CIS Kubernetes Benchmark v1.6.1","description":"Automated Validation of Kubernetes CIS Benchmark v1.6.1 Prescriptive guidance for establishing a secure configuration posture for Kubernetes 1.6.1\nFor additional reference: https://www.cisecurity.org/benchmark/kubernetes/","id":-70},"reportTime":"2023-06-09T11:00:31.243Z","rule":{"name":"Minimize access to create pods (RBAC)","ruleId":"D9.K8S.IAM.35","description":"The ability to create pods in a namespace can provide a number of opportunities for privilege escalation, such as assigning privileged service accounts to these pods or mounting hostPaths with access to sensitive data (unless Pod Security Policies are implemented to restrict this access). As such, access to create new pods should be restricted to the smallest possible group of users. The ability to create pods in a cluster opens up possibilities for privilege escalation and should be restricted, where possible.","remediation":"Where possible, remove create access to pod objects in the cluster.","complianceTags":"5.1.4","logicHash":"grYFwC76VTIueiiCNKmvrw","severity":"Low"},"account":{"id":"5af13ab5-72ed-43b6-9544-33c9236d62f0","name":"nu-openshift-cluster","vendor":"Kubernetes","dome9CloudAccountId":"5af13ab5-72ed-43b6-9544-33c9236d62f0","organizationalUnitId":"00000000-0000-0000-0000-000000000000","organizationalUnitPath":""},"region":"Global","entity":{"subjects":[{"apiGroup":null,"kind":"ServiceAccount","name":"machine-api-controllers","namespace":"openshift-machine-api"}],"role":{"name":"machine-api-controllers","rules":[{"apiGroups":["machine.openshift.io"],"nonResourceURLs":null,"resourceNames":null,"resources":["*"],"verbs":["*"]},{"apiGroups":["healthchecking.openshift.io"],"nonResourceURLs":null,"resourceNames":null,"resources":["*"],"verbs":["*"]},{"apiGroups":[""],"nonResourceURLs":null,"resourceNames":null,"resources":["configmaps"],"verbs":["get","list","watch","create","update","patch","delete"]},{"apiGroups":[""],"nonResourceURLs":null,"resourceNames":null,"resources":["secrets"],"verbs":["get","list","watch","create","update","patch","delete"]},{"apiGroups":["coordination.k8s.io"],"nonResourceURLs":null,"resourceNames":null,"resources":["leases"],"verbs":["get","list","watch","create","update","patch","delete"]},{"apiGroups":[""],"nonResourceURLs":null,"resourceNames":null,"resources":["events"],"verbs":["create","watch","list","patch"]},{"apiGroups":["metal3.io"],"nonResourceURLs":null,"resourceNames":null,"resources":["baremetalhosts"],"verbs":["get","list","watch","update","patch"]},{"apiGroups":["metal3.io"],"nonResourceURLs":null,"resourceNames":null,"resources":["baremetalhosts/status","baremetalhosts/finalizers"],"verbs":["update"]}],"aggregationRule":null,"kind":"Role"},"kind":"RoleBinding","tags":[],"namespace":"openshift-machine-api","annotations":[{"key":"include.release.openshift.io/self-managed-high-availability","value":"true"},{"key":"include.release.openshift.io/single-node-developer","value":"true"}],"labels":[],"creationTime":1667113755,"id":"cfee62dc-7699-4490-b84b-893cb543857e","type":"KubernetesRoleBinding","name":"machine-api-controllers","dome9Id":"11|5af13ab5-72ed-43b6-9544-33c9236d62f0|RoleBinding|cfee62dc-7699-4490-b84b-893cb543857e","accountNumber":"5af13ab5-72ed-43b6-9544-33c9236d62f0","assetLabels":null,"region":"Global","externalFindings":null},"remediationActions":[],"action":"Detect","additionalFields":[]}